{
  "$ref": "#/definitions/categories",
  "definitions": {
    "categories": {
      "type": "object",
      "properties": {
        "id": {
          "type": "string"
        },
        "slug": {
          "type": "string"
        },
        "title": {
          "type": "string"
        },
        "description": {
          "type": "string"
        },
        "iconName": {
          "type": "string"
        },
        "color": {
          "type": "string"
        },
        "bgColor": {
          "type": "string"
        },
        "items": {
          "type": "array",
          "items": {
            "type": "object",
            "properties": {
              "name": {
                "type": "string"
              },
              "slug": {
                "type": "string"
              },
              "description": {
                "type": "string"
              }
            },
            "required": [
              "name",
              "slug",
              "description"
            ],
            "additionalProperties": false
          }
        },
        "$schema": {
          "type": "string"
        }
      },
      "required": [
        "id",
        "slug",
        "title",
        "description",
        "iconName",
        "color",
        "bgColor",
        "items"
      ],
      "additionalProperties": false
    }
  },
  "$schema": "http://json-schema.org/draft-07/schema#"
}